<?xml version="1.0" encoding="UTF-8"?>
<!--
    Copyright 2017 Capital One Services, LLC and Bitwise, Inc.
    Licensed under the Apache License, Version 2.0 (the "License");
    you may not use this file except in compliance with the License.
    You may obtain a copy of the License at
    http://www.apache.org/licenses/LICENSE-2.0
    Unless required by applicable law or agreed to in writing, software
    distributed under the License is distributed on an "AS IS" BASIS,
    WITHOUT WARRANTIES OR CONDITIONS OF ANY KIND, either express or implied.
    See the License for the specific language governing permissions and
    limitations under the License.
 -->
 
 
<tns:Config xmlns:tns="hydrograph/ui/ComponentConfig" xmlns:xsi="http://www.w3.org/2001/XMLSchema-instance"
	xsi:schemaLocation="hydrograph/ui/ComponentConfig xsds/ComponentConfig.xsd ">
	<tns:component paletteIconPath="/icons/filter_palette.png" canvasIconPath="/icons/filter_canvas.png"
		name="Filter" nameInPalette="Filter" defaultNamePrefix="Filter" 
		description="Select specific records from input based on filter condition in the operation class."
		helpFilePath="/hydrograph.ui.help/html/Components/Filter.html"
		acronym="Fltr">
		<tns:category>TRANSFORM</tns:category>
		<tns:port>
			<tns:portSpecification  numberOfPorts="1" portAlignment="left" changePortCountDynamically="false" allowMultipleLinks="false" linkMandatory="true" >
				<tns:port sequenceOfPort="0" typeOfPort="in" labelOfPort="in0" portTerminal="in0" />
			</tns:portSpecification>
			<tns:portSpecification  numberOfPorts="1" portAlignment="right" changePortCountDynamically="false" allowMultipleLinks="false" linkMandatory="true">
				<tns:port sequenceOfPort="0" typeOfPort="out" labelOfPort="out0" portTerminal="out0" />
			</tns:portSpecification>
			<tns:portSpecification  numberOfPorts="1" portAlignment="bottom" changePortCountDynamically="false" allowMultipleLinks="false" linkMandatory="true">
				<tns:port sequenceOfPort="0" typeOfPort="unused" labelOfPort="un0" portTerminal="unused0" />
			</tns:portSpecification>
		</tns:port>
		
		<tns:property dataType="string" name="name" renderer="COMPONENT_NAME_WIDGET" type="USER"
			group="GENERAL" subGroup="DETAILS" showAsTooltip="TRUE" tooltipDataType="TEXT"
			usage="REQUIRED" propertyHelpText="Displays Name provided by the user">
			<tns:validator>NON_BLANK_STRING_VALIDATOR</tns:validator>
		</tns:property>
		
		<tns:property dataType="string" name="schema" renderer="STRAIGHT_SCHEMA_WIDGET" type="USER"
			group="SCHEMA" subGroup="RECORD_STRUCTURE_DETAILS" showAsTooltip="TRUE" tooltipDataType="LIST"
			usage="REQUIRED">
			<tns:validator>SCHEMA_GRID_VALIDATOR</tns:validator>
		</tns:property>
		
		<tns:property dataType="string" name="filterLogic" renderer="FILTER_LOGIC" type="USER"
			group="GENERAL" subGroup="CONFIGURATION" showAsTooltip="TRUE" tooltipDataType="LIST"
			usage="OPTIONAL" propertyHelpText="Specify java class for performing the Filter operation.#Specify expression for performing Filter operation.">
			<tns:validator>FILTER_DATA_VALIDATION</tns:validator>
		</tns:property>
			
		<tns:property dataType="string" name="runtime_properties" renderer="RUNTIME_PROPERTIES_WIDGET"
			type="USER" group="GENERAL" subGroup="CONFIGURATION" showAsTooltip="FALSE" tooltipDataType="NONE"
			usage="OPTIONAL" propertyHelpText="Used to override runtime Hadoop configurations \nspecific to this component at run time.">
		 <tns:validator>RUNTIME_PROPERTY_VALIDATOR</tns:validator>
		</tns:property>

		<tns:property dataType="string" name="batch" value="0" renderer="BATCH_WIDGET" type="USER"
			group="GENERAL" subGroup="CONFIGURATION" showAsTooltip="TRUE" tooltipDataType="TEXT"
			usage="REQUIRED" propertyHelpText="Specifies the execution sequence \nof this component in the job flow.">
			<tns:validator>INTEGER_VALIDATOR</tns:validator>
		</tns:property>
         
         <tns:property dataType="string" name="Propogate" renderer="PROPOGATE_WIDGET" type="USER"
			group="GENERAL" subGroup="CONFIGURATION" showAsTooltip="TRUE" tooltipDataType="TEXT"
			usage="OPTIONAL" propertyHelpText="Specifies propagating attributes from previous component in the job flow.">
		</tns:property>
	
	<tns:operations>
		<tns:interface class="hydrograph.engine.transformation.userfunctions.base.FilterBase"
			name="FILTER" />
	</tns:operations>
	</tns:component>
</tns:Config>