<?xml version="1.0" encoding="UTF-8"?>
<!--
    Copyright 2017 Capital One Services, LLC and Bitwise, Inc.
    Licensed under the Apache License, Version 2.0 (the "License");
    you may not use this file except in compliance with the License.
    You may obtain a copy of the License at
    http://www.apache.org/licenses/LICENSE-2.0
    Unless required by applicable law or agreed to in writing, software
    distributed under the License is distributed on an "AS IS" BASIS,
    WITHOUT WARRANTIES OR CONDITIONS OF ANY KIND, either express or implied.
    See the License for the specific language governing permissions and
    limitations under the License.
 -->

<tns:Config xmlns:tns="hydrograph/ui/ComponentConfig" xmlns:xsi="http://www.w3.org/2001/XMLSchema-instance"
	xsi:schemaLocation="hydrograph/ui/ComponentConfig xsds/ComponentConfig.xsd ">
	<tns:component paletteIconPath="/icons/runprogram_palette.png" canvasIconPath="/icons/runprogram_canvas.png"
		name="RunProgram" nameInPalette="Run Program" defaultNamePrefix="RunProgram" 
		description="Run's command given as input"
		helpFilePath="/hydrograph.ui.help/html/Components/Run_Program.html"
		acronym="Run">
		<tns:category>COMMAND</tns:category>
			<tns:port>
			
			<tns:portSpecification numberOfPorts="0" portAlignment="bottom" changePortCountDynamically="false" allowMultipleLinks="false" linkMandatory="false">
			</tns:portSpecification>
		</tns:port>
		
		<tns:property dataType="string" name="name" renderer="COMPONENT_NAME_WIDGET" type="USER"
			group="GENERAL" subGroup="DETAILS" showAsTooltip="TRUE" tooltipDataType="TEXT"
			usage="REQUIRED" propertyHelpText="Displays Name provided by the user"/>
		
		<tns:property dataType="string" name="runcommand" value="" renderer="RUNPROGRAM_TEXT_WIDGET" type="USER"
			group="GENERAL" subGroup="CONFIGURATION" showAsTooltip="TRUE" tooltipDataType="LINK"
			usage="REQUIRED" propertyHelpText="Displays command provided by user">
			<tns:validator>NON_EMPTY_STRING_VALIDATOR</tns:validator>
		</tns:property>
			
		
		<tns:property dataType="string" name="batch" value="0" renderer="BATCH_WIDGET" type="USER"
			group="GENERAL" subGroup="CONFIGURATION" showAsTooltip="TRUE" tooltipDataType="TEXT"
			usage="REQUIRED" propertyHelpText="Specifies the execution sequence \nof this component in the job flow.">
			<tns:validator>INTEGER_VALIDATOR</tns:validator>
		</tns:property>
	</tns:component>
</tns:Config>
