<?xml version="1.0" encoding="UTF-8"?>
<!--
    Copyright 2017 Capital One Services, LLC and Bitwise, Inc.
    Licensed under the Apache License, Version 2.0 (the "License");
    you may not use this file except in compliance with the License.
    You may obtain a copy of the License at
    http://www.apache.org/licenses/LICENSE-2.0
    Unless required by applicable law or agreed to in writing, software
    distributed under the License is distributed on an "AS IS" BASIS,
    WITHOUT WARRANTIES OR CONDITIONS OF ANY KIND, either express or implied.
    See the License for the specific language governing permissions and
    limitations under the License.
 -->


<tns:Config xmlns:tns="hydrograph/ui/ComponentConfig"
	xmlns:xsi="http://www.w3.org/2001/XMLSchema-instance"
	xsi:schemaLocation="hydrograph/ui/ComponentConfig xsds/ComponentConfig.xsd ">
	<tns:component paletteIconPath="/icons/partitionbyexpression_palette.png"
		canvasIconPath="/icons/partitionbyexpression_canvas.png" name="PartitionByExpression"
		nameInPalette="Partition By Expression" defaultNamePrefix="PartByExp"
		description="distributes data records to its output partitions based on evaluation of expression specified."
		helpFilePath="/hydrograph.ui.help/html/Components/Partition_By_Expression.html" acronym="PartXp">
		<tns:category>TRANSFORM</tns:category>
		<tns:port>
			<tns:portSpecification numberOfPorts="1"
				portAlignment="left" changePortCountDynamically="false"
				allowMultipleLinks="false" linkMandatory="true">
				<tns:port sequenceOfPort="0" typeOfPort="in" labelOfPort="in0"
					portTerminal="in0" />
			</tns:portSpecification>

			<tns:portSpecification numberOfPorts="1"
				portAlignment="bottom" changePortCountDynamically="false"
				allowMultipleLinks="false" linkMandatory="true">
				<tns:port sequenceOfPort="0" typeOfPort="unused"
					labelOfPort="un0" portTerminal="unused0" />
			</tns:portSpecification>

			<tns:portSpecification numberOfPorts="2"
				portAlignment="right" changePortCountDynamically="true"
				allowMultipleLinks="false" linkMandatory="true">
				<tns:port sequenceOfPort="0" typeOfPort="out" labelOfPort="out0"
					portTerminal="out0" />
				<tns:port sequenceOfPort="1" typeOfPort="out" labelOfPort="out1"
					portTerminal="out1" />
			</tns:portSpecification>
		</tns:port>

		<tns:property dataType="string" name="name"
			renderer="COMPONENT_NAME_WIDGET" type="USER" group="GENERAL"
			subGroup="DETAILS" showAsTooltip="TRUE" tooltipDataType="TEXT" usage="REQUIRED"
			propertyHelpText="Displays Name provided by the user" />

		<tns:property dataType="string" name="schema"
			renderer="STRAIGHT_SCHEMA_WIDGET" type="USER" group="SCHEMA"
			subGroup="RECORD_STRUCTURE_DETAILS" showAsTooltip="TRUE"
			tooltipDataType="LIST" usage="REQUIRED">
			<tns:validator>SCHEMA_GRID_VALIDATOR</tns:validator>

		</tns:property>

		<tns:property dataType="string" name="outPortCount"
			value="2" renderer="PARTITION_COMPONENT_OUTPUT_COUNT_WIDGET" type="USER"
			group="GENERAL" subGroup="CONFIGURATION" showAsTooltip="TRUE"
			tooltipDataType="TEXT" usage="REQUIRED"
			propertyHelpText="Specifies number of output partitions to be created. Default is 2.">
			<tns:validator>INTEGER_VALIDATOR</tns:validator>
		</tns:property>

		<tns:property dataType="string" name="filterLogic" renderer="FILTER_LOGIC" type="USER" group="GENERAL"
			subGroup="CONFIGURATION" showAsTooltip="TRUE" tooltipDataType="LINK"
			usage="REQUIRED"
			propertyHelpText="Specify java class for performing the partitioning.#Specify expression for performing the partitioning.">
			<tns:validator>FILTER_DATA_VALIDATION</tns:validator>
		</tns:property>

		<tns:property dataType="string" name="runtime_properties"
			renderer="RUNTIME_PROPERTIES_WIDGET" type="USER" group="GENERAL"
			subGroup="CONFIGURATION" showAsTooltip="FALSE" tooltipDataType="NONE"
			usage="OPTIONAL"
			propertyHelpText="Used to overwrite runtime Hadoop configurations specific to this component on runtime." />


		<tns:property dataType="string" name="batch" value="0"
			renderer="BATCH_WIDGET" type="USER" group="GENERAL" subGroup="CONFIGURATION"
			showAsTooltip="TRUE" tooltipDataType="TEXT" usage="REQUIRED"
			propertyHelpText="Specifies execution sequence of this component in the job flow.">
			<tns:validator>INTEGER_VALIDATOR</tns:validator>
		</tns:property>

		<tns:property dataType="string" name="Propogate"
			renderer="PROPOGATE_WIDGET" type="USER" group="GENERAL" subGroup="CONFIGURATION"
			showAsTooltip="TRUE" tooltipDataType="TEXT" usage="OPTIONAL"
			propertyHelpText="Specifies propagating attributes from previous component in the job flow.">
		</tns:property>

		<tns:operations>
			<tns:interface class="hydrograph.engine.transformation.userfunctions.base.CustomPartitionExpression"
				name="PartitionByExpression" />
		</tns:operations>
	</tns:component>
</tns:Config>
