<?xml version="1.0" encoding="UTF-8"?>
<!-- Copyright 2017 Capital One Services, LLC and Bitwise, Inc.
 Licensed under the Apache License, Version 2.0 (the "License");
 you may not use this file except in compliance with the License.
 You may obtain a copy of the License at
 http://www.apache.org/licenses/LICENSE-2.0
 Unless required by applicable law or agreed to in writing, software
 distributed under the License is distributed on an "AS IS" BASIS,
 WITHOUT WARRANTIES OR CONDITIONS OF ANY KIND, either express or implied.
 See the License for the specific language governing permissions and
 limitations under the License. -->
 
 
<tns:Config xmlns:tns="hydrograph/ui/ComponentConfig" xmlns:xsi="http://www.w3.org/2001/XMLSchema-instance"
	xsi:schemaLocation="hydrograph/ui/ComponentConfig xsds/ComponentConfig.xsd ">
	<tns:component paletteIconPath="/icons/input_xml_palette.png" canvasIconPath="/icons/input_xml_canvas.png"
		name="IXml" nameInPalette="XML" defaultNamePrefix="IXML" 
		description="Used to read xml file."
		helpFilePath="/hydrograph.ui.help/html/Components/input/Input_Xml.html"
		acronym="IXML">
		<tns:category>INPUT</tns:category>
		<tns:port>
			<tns:portSpecification  numberOfPorts="1" portAlignment="right" changePortCountDynamically="false" allowMultipleLinks="false" linkMandatory="true">
				<tns:port sequenceOfPort="0" typeOfPort="out" labelOfPort="out0" portTerminal="out0" />
			</tns:portSpecification>
		</tns:port>
		
		<tns:property dataType="string" name="name" renderer="COMPONENT_NAME_WIDGET" type="USER"
			group="GENERAL" subGroup="DETAILS" showAsTooltip="TRUE" tooltipDataType="TEXT"
			usage="REQUIRED" propertyHelpText="Displays Name provided by the user"/>
		
		<tns:property dataType="string" name="schema" renderer="XPATH_SCHEMA_WIDGET" type="USER"
			group="SCHEMA" subGroup="RECORD_STRUCTURE_DETAILS" showAsTooltip="TRUE" tooltipDataType="LIST"
			usage="REQUIRED">
			<tns:validator>XPATH_SCHEMA_GRID_VALIDATOR</tns:validator>
		</tns:property>
		
		<tns:property dataType="string" name="Path" renderer="XML_FILE_PATH_WIDGET" type="USER"
			group="GENERAL" subGroup="CONFIGURATION" showAsTooltip="TRUE" tooltipDataType="LINK"
			usage="REQUIRED" propertyHelpText="Displays the location of the file either Remote/Local. 
			\nAllows only underscore ‘_’ and alphanumeric characters.">
			<tns:validator>NON_BLANK_STRING_VALIDATOR</tns:validator>
		</tns:property>
		
		<tns:property dataType="string" name="absoluteXPath" value="" renderer="XPATH_QUERY_WIDGET"
			type="USER" group="GENERAL" subGroup="CONFIGURATION" showAsTooltip="TRUE" tooltipDataType="TEXT"
			usage="REQUIRED" propertyHelpText="Xpath for the xml">
			<tns:validator>NON_EMPTY_STRING_VALIDATOR</tns:validator>
		</tns:property>
		
		<tns:property dataType="string" name="rootTag" value="" renderer="ROOT_TAG_WIDGET"
			type="USER" group="GENERAL" subGroup="CONFIGURATION" showAsTooltip="TRUE" tooltipDataType="TEXT"
			usage="REQUIRED" propertyHelpText="Root tag for the xml">
			<tns:validator>NON_EMPTY_STRING_VALIDATOR</tns:validator>
		</tns:property>
		
		<tns:property dataType="string" name="rowTag" value="" renderer="ROW_TAG_WIDGET"
			type="USER" group="GENERAL" subGroup="CONFIGURATION" showAsTooltip="TRUE" tooltipDataType="TEXT"
			usage="REQUIRED" propertyHelpText="Row tag for the xml">
			<tns:validator>NON_EMPTY_STRING_VALIDATOR</tns:validator>
		</tns:property>
		
		<tns:property dataType="string" name="GenerateSchema"
			renderer="XML_GENERATE_SCHEMA_WIDGET" type="USER" group="GENERAL"
			subGroup="CONFIGURATION" showAsTooltip="TRUE" tooltipDataType="TEXT"
			usage="REQUIRED" propertyHelpText="Will be added soon.">
		</tns:property>
		
		
		<tns:property dataType="boolean" name="safe" value="False" renderer="SAFE_PROPERTY_WIDGET" type="USER"
			group="GENERAL" subGroup="CONFIGURATION" showAsTooltip="FALSE" tooltipDataType="NONE"
			usage="OPTIONAL" propertyHelpText="When True, allows the input fields to pass \nevaluation despite of Data type mismatch.">
			<tns:validator>BOOLEAN_OR_PARAMETER_VALIDATOR</tns:validator>
		</tns:property>
		
		<tns:property dataType="string" name="charset" value="UTF-8" renderer="CHARACTER_SET_WIDGET"
			type="USER" group="GENERAL" subGroup="CONFIGURATION" showAsTooltip="FALSE" tooltipDataType="NONE"
			usage="REQUIRED" propertyHelpText="Denotes the encoding system followed by the input file.">
			<tns:validator>NON_BLANK_STRING_VALIDATOR</tns:validator>
		</tns:property>
		
		<tns:property dataType="string" name="runtime_properties" renderer="RUNTIME_PROPERTIES_WIDGET"
			type="USER" group="GENERAL" subGroup="CONFIGURATION" showAsTooltip="FALSE" tooltipDataType="NONE"
			usage="OPTIONAL" propertyHelpText="Used to override runtime \nHadoop configurations specific to \nthis component at run time.">
		<tns:validator>RUNTIME_PROPERTY_VALIDATOR</tns:validator>
		</tns:property>
		
		<tns:property dataType="string" name="batch" value="0" renderer="BATCH_WIDGET" type="USER"
			group="GENERAL" subGroup="CONFIGURATION" showAsTooltip="TRUE" tooltipDataType="TEXT"
			usage="REQUIRED" propertyHelpText="Specifies the execution sequence of \nthis component in the job flow.">
			<tns:validator>INTEGER_VALIDATOR</tns:validator>
		</tns:property>
	</tns:component>
</tns:Config>