<?xml version="1.0" encoding="UTF-8"?>
<!--
    Copyright 2017 Capital One Services, LLC and Bitwise, Inc.
    Licensed under the Apache License, Version 2.0 (the "License");
    you may not use this file except in compliance with the License.
    You may obtain a copy of the License at
    http://www.apache.org/licenses/LICENSE-2.0
    Unless required by applicable law or agreed to in writing, software
    distributed under the License is distributed on an "AS IS" BASIS,
    WITHOUT WARRANTIES OR CONDITIONS OF ANY KIND, either express or implied.
    See the License for the specific language governing permissions and
    limitations under the License.
 -->
 
 
<tns:Config xmlns:tns="hydrograph/ui/ComponentConfig" xmlns:xsi="http://www.w3.org/2001/XMLSchema-instance"
	xsi:schemaLocation="hydrograph/ui/ComponentConfig xsds/ComponentConfig.xsd ">
	<tns:component paletteIconPath="/icons/cumulate_palette.png" canvasIconPath="/icons/cumulate_canvas.png"
		name="Cumulate" nameInPalette="Cumulate" defaultNamePrefix="Cumulate" 
		description="Performs cumulate on data specified in a java operation class."
		helpFilePath="/hydrograph.ui.help/html/Components/Cumulate.html"
		acronym="Cmlt">
		<tns:category>TRANSFORM</tns:category>
		<tns:port>
			<tns:portSpecification numberOfPorts="1" portAlignment="left" changePortCountDynamically="false" allowMultipleLinks="false" linkMandatory="true">
				<tns:port sequenceOfPort="0"  typeOfPort="in" portTerminal="in0" labelOfPort="in0"/>
			</tns:portSpecification>
			<tns:portSpecification numberOfPorts="1" portAlignment="right" changePortCountDynamically="false" allowMultipleLinks="false" linkMandatory="true">
				<tns:port sequenceOfPort="0" typeOfPort="out"  portTerminal="out0" labelOfPort="out0"/>
			</tns:portSpecification>
		</tns:port>
		
		<tns:property dataType="string" name="name" renderer="COMPONENT_NAME_WIDGET" type="USER"
			group="GENERAL" subGroup="DETAILS" showAsTooltip="TRUE" tooltipDataType="TEXT"
			usage="REQUIRED" propertyHelpText="Displays Name provided by the user"/>
		

		<tns:property dataType="string" name="schema" renderer="TRANSFORM_SCHEMA_WIDGET" type="USER"
			group="SCHEMA" subGroup="RECORD_STRUCTURE_DETAILS" showAsTooltip="TRUE" tooltipDataType="LIST"
         usage="REQUIRED">
			<tns:validator>TRANSFORM_SCHEMA_GRID_VALIDATOR</tns:validator>
		</tns:property>
		
		
		<tns:property dataType="string" name="Key_fields" renderer="COLUMN_NAME_WIDGET" type="USER"
			group="GENERAL" subGroup="CONFIGURATION" showAsTooltip="TRUE" tooltipDataType="LIST"
			usage="REQUIRED" propertyHelpText="Fields used for grouping.">
			<tns:validator>KEY_FIELDS_VALIDATOR</tns:validator>
		</tns:property>
			
		<tns:property dataType="string" name="Secondary_keys" renderer="SECONDARY_COLUMN_KEYS_WIDGET" type="USER"
			group="GENERAL" subGroup="CONFIGURATION" showAsTooltip="TRUE" tooltipDataType="LIST"
			usage="OPTIONAL" propertyHelpText="Fields used for sorting within the groups.">
		</tns:property>
		
		<tns:property dataType="string" name="operation" renderer="CUMULATE_WIDGET" type="USER"
			group="GENERAL" subGroup="CONFIGURATION" showAsTooltip="TRUE" tooltipDataType="LINK"
			usage="OPTIONAL" propertyHelpText="Field Mapping view.">
			<tns:validator>TRANSFORM_MAPPING_VALIDATOR</tns:validator>
			</tns:property>

		<tns:property dataType="string" name="runtime_properties" renderer="RUNTIME_PROPERTIES_WIDGET"
			type="USER" group="GENERAL" subGroup="CONFIGURATION" showAsTooltip="FALSE" tooltipDataType="NONE"
			usage="OPTIONAL" propertyHelpText="Used to override runtime Hadoop configurations \nspecific to this component at run time.">
			<tns:validator>RUNTIME_PROPERTY_VALIDATOR</tns:validator>
		</tns:property>
		
			
		<tns:property dataType="string" name="batch" value="0" renderer="BATCH_WIDGET" type="USER"
			group="GENERAL" subGroup="CONFIGURATION" showAsTooltip="TRUE" tooltipDataType="TEXT"
			usage="REQUIRED" propertyHelpText="Specifies the execution sequence \nof this component in the job flow.">
			<tns:validator>INTEGER_VALIDATOR</tns:validator>

		</tns:property>
		
		<tns:property dataType="string" name="Propogate" renderer="PROPOGATE_WIDGET" type="USER"
			group="GENERAL" subGroup="CONFIGURATION" showAsTooltip="TRUE" tooltipDataType="TEXT"
			usage="OPTIONAL" propertyHelpText="Specifies propagating attributes from previous component in the job flow.">
		</tns:property>
		
	
	<tns:operations>
		<tns:interface
			class="hydrograph.engine.transformation.userfunctions.base.CumulateTransformBase"
			name="CUMULATE" />
		<tns:stdOperation class="hydrograph.engine.transformation.userfunctions.cumulate.Sum"
			name="Sum" />
		<tns:stdOperation
			class="hydrograph.engine.transformation.userfunctions.cumulate.Count" name="Count" />
		<tns:stdOperation
			class="hydrograph.engine.transformation.userfunctions.cumulate.StringAppend"
			name="StringAppend" />
	</tns:operations>		
	</tns:component>
</tns:Config>