<?xml version="1.0" encoding="UTF-8"?>
<!--
    Copyright 2017 Capital One Services, LLC and Bitwise, Inc.
    Licensed under the Apache License, Version 2.0 (the "License");
    you may not use this file except in compliance with the License.
    You may obtain a copy of the License at
    http://www.apache.org/licenses/LICENSE-2.0
    Unless required by applicable law or agreed to in writing, software
    distributed under the License is distributed on an "AS IS" BASIS,
    WITHOUT WARRANTIES OR CONDITIONS OF ANY KIND, either express or implied.
    See the License for the specific language governing permissions and
    limitations under the License.
 -->
 
 

<tns:Config xmlns:tns="hydrograph/ui/ComponentConfig" xmlns:xsi="http://www.w3.org/2001/XMLSchema-instance"
	xsi:schemaLocation="hydrograph/ui/ComponentConfig xsds/ComponentConfig.xsd">
	<tns:component paletteIconPath="/icons/runsql_palette.png" canvasIconPath="/icons/runsql.png"
		name="RunSQL" nameInPalette="RunSQL" defaultNamePrefix="RunSQL" 
		description="Execute SQL queries on given databases"
		helpFilePath="/hydrograph.ui.help/html/Components/RunSQL.html"
		acronym="RnSQL">
		<tns:category>COMMAND</tns:category>
		<tns:port>
			<tns:portSpecification numberOfPorts="0" portAlignment="bottom" changePortCountDynamically="false" allowMultipleLinks="false" linkMandatory="false">
			</tns:portSpecification>
		</tns:port>
		
		<tns:property dataType="string" name="name" renderer="COMPONENT_NAME_WIDGET" type="USER"
			group="GENERAL" subGroup="DETAILS" showAsTooltip="TRUE" tooltipDataType="TEXT"
			usage="REQUIRED" propertyHelpText="Displays Name provided by the user"/>
		
		<tns:property dataType="string" name="databaseConnectionName" value="Oracle" renderer="DATABASE_LIST_WIDGET"
			type="USER" group="GENERAL" subGroup="CONFIGURATION" showAsTooltip="FALSE" tooltipDataType="NONE"
			usage="REQUIRED" propertyHelpText="List of databases supported by the component">
			<tns:validator>NON_BLANK_STRING_VALIDATOR</tns:validator>
		</tns:property>

		<tns:property dataType="string" name="databaseName" value="" renderer="DATABASE_NAME_WIDGET" type="USER"
			group="GENERAL" subGroup="CONFIGURATION" showAsTooltip="TRUE" tooltipDataType="LINK"
			usage="REQUIRED" propertyHelpText="Database name to connect.">
			<tns:validator>NON_BLANK_STRING_VALIDATOR</tns:validator>
		</tns:property>	
				
		<tns:property dataType="string" name="hostName" value="" renderer="HOST_NAME_WIDGET"
			type="USER" group="GENERAL" subGroup="CONFIGURATION" showAsTooltip="TRUE" tooltipDataType="TEXT"
			usage="REQUIRED" propertyHelpText="Displays the Database Host Name provided by the user">
			<tns:validator>NON_BLANK_STRING_VALIDATOR</tns:validator>
		</tns:property>
			
		<tns:property dataType="string" name="port" value="1521" renderer="PORT_WIDGET"
			type="USER" group="GENERAL" subGroup="CONFIGURATION" showAsTooltip="TRUE" tooltipDataType="TEXT"
			usage="REQUIRED" propertyHelpText="Displays the Database Port provided by the user">
			<tns:validator>PORT_VALIDATOR</tns:validator>
		</tns:property>
		
		
		<tns:property dataType="string" name="userName" value="" renderer="USER_NAME_WIDGET"
			type="USER" group="GENERAL" subGroup="CONFIGURATION" showAsTooltip="TRUE" tooltipDataType="TEXT"
			usage="REQUIRED" propertyHelpText="Displays the Database User Name provided by the user">
			<tns:validator>NON_BLANK_STRING_VALIDATOR</tns:validator>
		</tns:property>
		
		<tns:property dataType="string" name="password" value="" renderer="PASSWORD_WIDGET"
			type="USER" group="GENERAL" subGroup="CONFIGURATION" showAsTooltip="FALSE" tooltipDataType="TEXT"
			usage="REQUIRED" propertyHelpText="Password requires for connection with oracle database">
			<tns:validator>NON_BLANK_STRING_VALIDATOR</tns:validator>
		</tns:property>
		
		<tns:property dataType="string" name="runsqlquery" value="" renderer="RUN_SQL_QUERY_WIDGET" type="USER"
			group="GENERAL" subGroup="CONFIGURATION" showAsTooltip="TRUE" tooltipDataType="LINK"
			usage="REQUIRED" propertyHelpText="Displays command provided by user">
			<tns:validator>NON_EMPTY_STRING_VALIDATOR</tns:validator>
		</tns:property>
		
		<tns:property dataType="string" name="batch" value="0" renderer="BATCH_WIDGET" type="USER"
			group="GENERAL" subGroup="CONFIGURATION" showAsTooltip="TRUE" tooltipDataType="TEXT"
			usage="REQUIRED" propertyHelpText="Specifies the execution sequence of \nthis component in the job flow.">
			<tns:validator>INTEGER_VALIDATOR</tns:validator>
		</tns:property>
	</tns:component>
</tns:Config>