<?xml version="1.0" encoding="UTF-8"?>
<!--
    Copyright 2017 Capital One Services, LLC and Bitwise, Inc.
    Licensed under the Apache License, Version 2.0 (the "License");
    you may not use this file except in compliance with the License.
    You may obtain a copy of the License at
    http://www.apache.org/licenses/LICENSE-2.0
    Unless required by applicable law or agreed to in writing, software
    distributed under the License is distributed on an "AS IS" BASIS,
    WITHOUT WARRANTIES OR CONDITIONS OF ANY KIND, either express or implied.
    See the License for the specific language governing permissions and
    limitations under the License.
 -->
 
 
<tns:Config xmlns:tns="hydrograph/ui/ComponentConfig" xmlns:xsi="http://www.w3.org/2001/XMLSchema-instance"
	xsi:schemaLocation="hydrograph/ui/ComponentConfig xsds/ComponentConfig.xsd ">
	<tns:component paletteIconPath="/icons/join_palette.png" canvasIconPath="/icons/join_canvas.png"
		name="Join" nameInPalette="Join" defaultNamePrefix="Join" 
		description="Joins two or more input sources." 
		helpFilePath="/hydrograph.ui.help/html/Components/Join.html"
		acronym="Join">
		<tns:category>TRANSFORM</tns:category>
		<tns:port>
			<tns:portSpecification  numberOfPorts="2" portAlignment="left" changePortCountDynamically="true" allowMultipleLinks="false" linkMandatory="true">
				<tns:port sequenceOfPort="0" typeOfPort="in" labelOfPort="in0" portTerminal="in0" />
				<tns:port sequenceOfPort="1" typeOfPort="in" labelOfPort="in1" portTerminal="in1"/>
			</tns:portSpecification>
			<tns:portSpecification  numberOfPorts="2" portAlignment="bottom" changePortCountDynamically="true" allowMultipleLinks="false" linkMandatory="true">
				<tns:port sequenceOfPort="0" typeOfPort="unused" labelOfPort="un0" portTerminal="unused0" />
				<tns:port sequenceOfPort="1" typeOfPort="unused" labelOfPort="un1" portTerminal="unused1" />
			</tns:portSpecification>
			<tns:portSpecification  numberOfPorts="1" portAlignment="right" changePortCountDynamically="false" allowMultipleLinks="false" linkMandatory="true">
				<tns:port sequenceOfPort="0" typeOfPort="out" labelOfPort="out0" portTerminal="out0" />
			</tns:portSpecification>
		</tns:port>
		
		<tns:property dataType="string" name="name" renderer="COMPONENT_NAME_WIDGET" type="USER"
			group="GENERAL" subGroup="DETAILS" showAsTooltip="TRUE" tooltipDataType="TEXT"
			usage="REQUIRED" propertyHelpText="Displays Name provided by the user"/>
			

		<tns:property dataType="string" name="schema" renderer="TRANSFORM_SCHEMA_WIDGET" type="USER"
			group="SCHEMA" subGroup="RECORD_STRUCTURE_DETAILS" showAsTooltip="TRUE" tooltipDataType="LIST"
			usage="REQUIRED">
			<tns:validator>TRANSFORM_SCHEMA_GRID_VALIDATOR</tns:validator>
		</tns:property>
			
		<tns:property dataType="string" name="inPortCount|unusedPortCount" value="2" renderer="JOIN_INPUT_COUNT_WIDGET" type="USER"
			group="GENERAL" subGroup="CONFIGURATION" showAsTooltip="TRUE" tooltipDataType="TEXT"
			usage="REQUIRED" propertyHelpText="Specifies number of inputs for the Join operation. Default 2.">
		</tns:property>
			
		<tns:property dataType="string" name="join_config" renderer="JOIN_TYPE_WIDGET" type="USER"
			group="GENERAL" subGroup="CONFIGURATION" showAsTooltip="TRUE" tooltipDataType="LIST"
			usage="REQUIRED" propertyHelpText="Specifies key fields and Join type">
			<tns:validator>JOIN_CONFIG_VALIDATOR</tns:validator>
		</tns:property>
		
		<tns:property dataType="string" name="join_mapping"  renderer="JOIN_MAPPING_WIDGET" type="USER"
			group="GENERAL" subGroup="CONFIGURATION" showAsTooltip="TRUE" tooltipDataType="LINK"
			usage="REQUIRED" propertyHelpText="Fields mapping view.">
			<tns:validator>JOIN_MAPPING_VALIDATOR</tns:validator>
		</tns:property>
		
		<tns:property dataType="string" name="runtime_properties" renderer="RUNTIME_PROPERTIES_WIDGET"
			type="USER" group="GENERAL" subGroup="CONFIGURATION" showAsTooltip="FALSE" tooltipDataType="NONE"
			usage="OPTIONAL" propertyHelpText="Used to override runtime Hadoop configurations \nspecific to this component at run time.">
		<tns:validator>RUNTIME_PROPERTY_VALIDATOR</tns:validator>
		</tns:property>
		
		<tns:property dataType="string" name="batch" value="0" renderer="BATCH_WIDGET" type="USER"
			group="GENERAL" subGroup="CONFIGURATION" showAsTooltip="TRUE" tooltipDataType="TEXT"
			usage="REQUIRED" propertyHelpText="Specifies the execution sequence \nof this component in the job flow.">
			<tns:validator>INTEGER_VALIDATOR</tns:validator>
		</tns:property>
		 <tns:property dataType="string" name="Propogate" renderer="PROPOGATE_WIDGET" type="USER"
			group="GENERAL" subGroup="CONFIGURATION" showAsTooltip="TRUE" tooltipDataType="TEXT"
			usage="OPTIONAL" propertyHelpText="Specifies propagating attributes from previous component in the job flow.">
		</tns:property>
	</tns:component>
</tns:Config>