<?xml version="1.0" encoding="UTF-8"?>
<!--
    Copyright 2017 Capital One Services, LLC and Bitwise, Inc.
    Licensed under the Apache License, Version 2.0 (the "License");
    you may not use this file except in compliance with the License.
    You may obtain a copy of the License at
    http://www.apache.org/licenses/LICENSE-2.0
    Unless required by applicable law or agreed to in writing, software
    distributed under the License is distributed on an "AS IS" BASIS,
    WITHOUT WARRANTIES OR CONDITIONS OF ANY KIND, either express or implied.
    See the License for the specific language governing permissions and
    limitations under the License.
 -->
 
 
<tns:Config xmlns:tns="hydrograph/ui/ComponentConfig" xmlns:xsi="http://www.w3.org/2001/XMLSchema-instance"
	xsi:schemaLocation="hydrograph/ui/ComponentConfig xsds/ComponentConfig.xsd ">
	<tns:component paletteIconPath="/icons/output_file_palette.png" canvasIconPath="/icons/output_file_canvas.png"
		name="OFParquet" nameInPalette="File Parquet" defaultNamePrefix="OFParquet" 
		description="Used to write a Parquet file."
		helpFilePath="/hydrograph.ui.help/html/Components/Output_File_Parquet.html"
		acronym="OFPrq">
		<tns:category>OUTPUT</tns:category>
		<tns:port>
			<tns:portSpecification numberOfPorts="1" portAlignment="left" changePortCountDynamically="false" allowMultipleLinks="false" linkMandatory="true">
				<tns:port sequenceOfPort="0" typeOfPort="in" labelOfPort="in0" portTerminal="in0" />
			</tns:portSpecification>
		</tns:port>
		
		<tns:property dataType="string" name="name" renderer="COMPONENT_NAME_WIDGET" type="USER"
			group="GENERAL" subGroup="DETAILS" showAsTooltip="TRUE" tooltipDataType="TEXT"
			usage="REQUIRED"/>
		
		<tns:property dataType="string" group="SCHEMA" subGroup="RECORD_STRUCTURE_DETAILS"
			name="schema" renderer="SCHEMA_WIDGET" type="USER" showAsTooltip="FALSE"
			tooltipDataType="NONE" usage="REQUIRED">
			<tns:validator>SCHEMA_GRID_VALIDATOR</tns:validator>
		</tns:property>
		
		<tns:property dataType="string" group="GENERAL" subGroup="CONFIGURATION" name="Path"
			renderer="FILE_PATH_WIDGET" type="USER" showAsTooltip="TRUE" tooltipDataType="LINK"
			usage="REQUIRED">
			<tns:validator>NON_BLANK_STRING_VALIDATOR</tns:validator>
		</tns:property>
		
		<tns:property dataType="string" group="GENERAL" subGroup="CONFIGURATION" name="overWrite" value="False"
			renderer="OVERWRITE_WIDGET" type="USER" showAsTooltip="FALSE" tooltipDataType="NONE"
			usage="OPTIONAL" propertyHelpText="If ‘Overwrite’ property is true, the output location will be overwritten. Existing file / folder contents will be deleted.">
			<tns:validator>BOOLEAN_OR_PARAMETER_VALIDATOR</tns:validator>
		</tns:property>
		
		<tns:property dataType="string" group="GENERAL" subGroup="CONFIGURATION" name="runtime_properties"
			renderer="RUNTIME_PROPERTIES_WIDGET" type="USER" showAsTooltip="FALSE" tooltipDataType="NONE"
			usage="OPTIONAL">
		<tns:validator>RUNTIME_PROPERTY_VALIDATOR</tns:validator>
		</tns:property>
		
		<tns:property dataType="string" name="batch" value="0" renderer="BATCH_WIDGET" type="USER"
			group="GENERAL" subGroup="CONFIGURATION" showAsTooltip="TRUE" tooltipDataType="TEXT"
			usage="REQUIRED">
			<tns:validator>INTEGER_VALIDATOR</tns:validator>
		</tns:property>
	</tns:component>
</tns:Config>
