<?xml version="1.0" encoding="UTF-8"?>
<!--
    Copyright 2017 Capital One Services, LLC and Bitwise, Inc.
    Licensed under the Apache License, Version 2.0 (the "License");
    you may not use this file except in compliance with the License.
    You may obtain a copy of the License at
    http://www.apache.org/licenses/LICENSE-2.0
    Unless required by applicable law or agreed to in writing, software
    distributed under the License is distributed on an "AS IS" BASIS,
    WITHOUT WARRANTIES OR CONDITIONS OF ANY KIND, either express or implied.
    See the License for the specific language governing permissions and
    limitations under the License.
 -->
 
 
<tns:Config xmlns:tns="hydrograph/ui/ComponentConfig"
	xmlns:xsi="http://www.w3.org/2001/XMLSchema-instance"
	xsi:schemaLocation="hydrograph/ui/ComponentConfig xsds/ComponentConfig.xsd ">
	<tns:component paletteIconPath="/icons/output_subjob_palette.png"
		canvasIconPath="/icons/output_subjob_canvas.png" name="OutputSubjobComponent"
		nameInPalette="Output Socket for subjob" defaultNamePrefix="OutSubjob"
		description="Represents the out sockets for a subjob."
		helpFilePath="/hydrograph.ui.help/html/Components/Dummy.html"  acronym="OSubS">
		<tns:category>SUBJOB</tns:category>

		
		<tns:port>
			<tns:portSpecification numberOfPorts="1" portAlignment="left" changePortCountDynamically="true" allowMultipleLinks="false" linkMandatory="true">
				<tns:port sequenceOfPort="0" typeOfPort="in" portTerminal="in0" labelOfPort="in0"/>
			</tns:portSpecification>
			
			<tns:portSpecification numberOfPorts="0" portAlignment="right" changePortCountDynamically="false" allowMultipleLinks="false" linkMandatory="true">
			</tns:portSpecification>
			
			<tns:portSpecification numberOfPorts="0" portAlignment="bottom" changePortCountDynamically="false" allowMultipleLinks="false" linkMandatory="true">
			</tns:portSpecification>
		</tns:port>			
		
		<tns:property dataType="string" name="name" renderer="COMPONENT_NAME_WIDGET" type="USER"
			group="GENERAL" subGroup="DETAILS" showAsTooltip="TRUE" tooltipDataType="TEXT"
			usage="REQUIRED" propertyHelpText="Displays Name provided by the user"/>
		
		<tns:property dataType="string" name="inPortCount" value="1" renderer="INPUT_COUNT_WIDGET" type="USER"
			group="GENERAL" subGroup="CONFIGURATION" showAsTooltip="TRUE" tooltipDataType="TEXT"
			usage="REQUIRED" propertyHelpText="Specifies number of input ports. Default 1">
			<tns:validator>INTEGER_VALIDATOR</tns:validator>
		</tns:property>
		
		</tns:component>
</tns:Config>